No,job_id,job_title,requirements,location,category,subcategory,date_upload,type,Salary,company,5,4,3,2,1
150,73291833,"Expert Data Scientist","Menganalisis data dengan menggunakan teknik-teknik analisis statistik dan machine learning untuk mengidentifikasi tren, pola, dan wawasan bisnis yang relevan.
Mengembangkan model prediksi dan algoritma yang canggih untuk meramalkan perilaku pelanggan, permintaan pasar, dan kinerja produk.
Mengolah dan membersihkan data dari berbagai sumber untuk memastikan kualitas dan keakuratan data yang digunakan dalam analisis.
Berkolaborasi dengan tim lintas disiplin untuk mengidentifikasi tantangan bisnis dan mengusulkan solusi berdasarkan analisis data.
Menerapkan metode visualisasi data yang efektif untuk menyajikan wawasan secara jelas kepada pemangku kepentingan.
S1/S2 di bidang Ilmu Komputer, Statistik, Matematika, atau bidang yang relevan.
Pengalaman dalam menerapkan teknik analisis data dan machine learning untuk memecahkan masalah bisnis yang kompleks.
Kemampuan dalam menggunakan bahasa pemrograman seperti Python atau R untuk analisis data dan pengembangan model.
Pengalaman dengan alat-alat analisis data seperti pandas, NumPy, scikit-learn, atau alat-alat sejenis.
Pengetahuan tentang teknik visualisasi data dan alat-alat seperti Matplotlib, Seaborn, atau alat visualisasi lainnya.
Kemampuan komunikasi yang baik untuk menyajikan temuan kompleks secara jelas kepada audiens non-teknis.
Keahlian dalam pengolahan dan analisis big data akan menjadi nilai tambah.
Memiliki pengalaman minimal 3 tahun dibidang data science.
What's your expected monthly basic salary?
How many years' experience do you have as a Data Scientist?
Have you worked in a role which requires experience with machine learning techniques?


Insights on salary & in-demand skills


Reviews from people working in the industry

","West Java","Science & Technology","Mathematics, Statistics & Information Sciences",2024-01-24,"Full time",,"PT. NUON DIGITAL INDONESIA",4,1,1,0,0
151,73330953,"Data Analyst Staff","Usia min. 23 tahun
Pendidikan min. S1 Ilmu Komputer, Matematika, Manajemen Informasi, dan Statistik
Pengalaman min. 1 tahun sebagai Data Analyst
Menguasai Excel, Power Point, SQL, dan program analisa lainnya
Bersedia ditempatkan di Mayora Group Headquarter, Daan Mogot


Insights on salary & in-demand skills


Reviews from people working in the industry

","West Jakarta","Information & Communication Technology","Database Development & Administration",2024-01-26,"Full time",,"PT Mayora Indah Tbk",206,224,76,5,8
152,73312054,"Data Analis","How many years' experience do you have as a data analyst?
Which of the following data analytics tools are you experienced with?
Are you willing to undergo a pre-employment background check?
Are you available to travel for this role when required?


Insights on salary & in-demand skills


Reviews from people working in the industry

",Jakarta,"Science & Technology","Mathematics, Statistics & Information Sciences",2024-01-25,"Full time",,"PT Suriatama",0,1,2,0,0
153,73365910,"Data Engineer","Bachelor's degree from computer science or related fields, or equivalent software engineering experience
Advanced SQL knowledge and experience working with relational databases, query authoring (SQL). Preferably on MS SQL
Advanced Knowledge in reporting service tools. Preferably Microsoft SSRS
Advanced Knowledge in ETL / data pipeline applications. Preferably Microsoft SSIS
Experienced in performing root cause analysis on internal and external data and processes to answer specific business questions and identify opportunities for improvement
Have an understanding and experience regarding the reporting dashboard and data warehouse concepts
Experienced in object-oriented/object function scripting languages: Python, Java, C#,C++,
Proficiency in source control i.e. Git
Got 2+ years of experience in Data Engineering role
How many years' experience do you have as a Data Engineer?",Jakarta,"Information & Communication Technology","Database Development & Administration",2024-01-29,"Full time","Rp 7,000,000 – Rp 10,000,000 per month","PT Rapid Teknologi Indonesia",0,0,0,0,0
154,73451682,"Data Platform Engineer","To administer, test, and implement computer databases, applying knowledge of database management systems. 
Coordinate changes to computer databases. 
Identify, investigate, and resolve database performance issues, database capacity, and database scalability. 
May plan, coordinate, and implement security measures to safeguard computer databases.
Minimum 1-year experience as data engineer or in similar role
Having Knowledge of programming languages:
- Java
- Python
- Bash script
Hands on experience with SQL
Familiar with some of big data stacks like Hadoop, Google Cloud Bigquery, Google Cloud Dataflow, Apache Airflow, Apache NiFi, Kafka/PubSub, NoSQL database.
What's your expected monthly basic salary?
How many years' experience do you have as a Data Platform Engineer?
Which of the following programming languages are you experienced in?
How would you rate your English language skills?


Research salaries and job trends


Access free tools, templates and articles that help you stand out


Discover pathways to a huge range of careers

",Jakarta,"Information & Communication Technology","Engineering - Software",2024-02-01,Contract/Temp,,"PT. Berca Hardayaperkasa",41,43,22,2,2
155,73384646,"Data Analyst (Food and Beverage Industry)","Berapa gaji bulanan yang kamu inginkan?
Berapa tahun pengalaman kerjamu sebagai analis data?
Bahasa apa saja di bawah ini yang fasih kamu gunakan?
Bagaimana kamu menilai kemampuan bahasa Inggrismu?
Berapa lama waktu yang kamu butuhkan untuk memberi tahu perusahaanmu saat ini?
Apakah kamu bersedia bepergian untuk pekerjaan ini saat dibutuhkan?
Apakah kamu bersedia menjalani pemeriksaan latar belakang prakerja?
Apakah kamu bersedia menjalani pemeriksaan kesehatan prakerja?","North Jakarta",Sales,"New Business Development",2024-01-30,"Full time",,"PT Masuya Graha Trikencana (Jakarta)",3,2,2,1,0
157,73699224,"Informatica Developer","Design and implement scalable, high-performance data architectures that support the organization's data needs.
Develop and maintain efficient Extract, Transform, Load (ETL) processes for ingesting data from various sources into the data warehouse.
Manage and optimize databases, data lakes, and other storage solutions to ensure efficient data retrieval and storage.
Implement data quality checks and ensure data integrity throughout the data lifecycle.
Collaborate with cross-functional teams, including data scientists, analysts, and business stakeholders, to understand data requirements and deliver solutions.
Bachelor's or Master's degree in Computer Science, Information Technology, or a related field.
Proven experience as a data engineer or in a similar role.
Proficient in programming languages such as Python, Java, Inforatica Powe Center, and Scala.
Strong experience with data modeling, ETL development, Informatica, and data warehousing.
Familiarity with database systems (SQL and NoSQL) and big data technologies.
Knowledge of cloud platforms (e.g., AWS, Azure, GCP) and their data services.
Excellent problem-solving and communication skills.
What's your expected monthly basic salary?


Research salaries and job trends


Access free tools, templates and articles that help you stand out


Discover pathways to a huge range of careers

",Jakarta,"Information & Communication Technology",Developers/Programmers,2024-02-13,"Full time",,"PT. Indocyber Global Teknologi (iGLO)",2,8,9,6,5
159,73451735,"Data Analyst","Berapa gaji bulanan yang kamu inginkan?
Berapa tahun pengalaman kerjamu sebagai analis data?
Bagaimana kamu menilai kemampuan bahasa Inggrismu?


Insights on salary & in-demand skills


Reviews from people working in the industry

","Central Jakarta","Information & Communication Technology","Database Development & Administration",2024-02-01,"Full time","Rp 4.500.000 – Rp 5.000.000 per month","GLOBAL INVESTA CAKRAWALA",0,0,0,0,0
160,73448461,"Staff Data Analyst","Berapa gaji bulanan yang kamu inginkan?
Berapa tahun pengalaman kerjamu sebagai analis data?
Produk Microsoft Office apa saja di bawah ini yang bisa kamu gunakan?
Apakah kamu bersedia bepergian untuk pekerjaan ini saat dibutuhkan?
Apakah kamu bersedia bekerja di luar jam kerja biasa saat dibutuhkan? (cth. akhir pekan, malam hari, hari libur nasional)
How many years' experience do you have as an Excel Analyst?
How many years' experience do you have as a Data Integration Analyst?


Insights on salary & in-demand skills


Reviews from people working in the industry

","North Jakarta","Administration & Office Support","Administrative Assistants",2024-02-01,"Full time",,"PT Global Jet Express",10,17,10,2,1
161,73360219,"Data Engineer","Designing and implementing data models to support the needs of the business.
Creating conceptual, logical, and physical data models.
Developing custom scripts for data manipulation and analysis.
Collaborating with data scientists and analysts to understand data requirements and support analytical initiatives.
Monitoring and improving data quality through validation and cleansing processes.
Integrating data from different sources to provide a unified view.
Creating and maintaining technical documentation for data-related projects.
What's your expected monthly basic salary?
How many years' experience do you have as a Data Engineer?
How many years' experience do you have using SQL queries?","South Jakarta","Science & Technology","Mathematics, Statistics & Information Sciences",2024-01-29,"Full time",,"PT Nusantara Duta Solusindo (NDS)",0,0,0,0,0
162,73217999,"Data Engineer","Perform data exploration, data cleaning, data imputation, and feature engineering on unstructured and structured data.
Build the infrastructure for optimal extraction, transformation, and loading (ETL) of data from a wide variety of data sources.
Develop and maintain optimal data pipeline architecture for training statistical and machine learning models such as regression and classification.
Develop and maintain evaluations to measure the effectiveness of training data. This includes measuring the capabilities of models on a variety of tasks and domains.
Collaborate with data scientists and machine learning engineers to develop a comprehensive data science/machine learning solution pipeline.
Bachelor's degree from computer science or related fields, or equivalent software engineering experience.
Proficiency in Python programming language.
Experience in dataset processing and feature engineering using tools such as Numpy, Pandas, and Scikit-Learn.
Visualization skills using tools such as Matplotlib, Seaborn, and Bokeh.
Understanding of deep learning frameworks such as Pytorch and TensorFlow.
Understanding of SQL and NoSQL.
Understands Hadoop / Spark / Kafka / Hive / Presto.
Proficiency in source control i.e. Git.
Deep understanding of Object-Oriented Programming (OOP) concepts such as inheritance, delegation, and abstract class.
Understanding of cloud-native technologies such as AWS, GCP, and Azure.
Experience in using Docker.
Experience in using AWS services such as S3, EC2, Glue, Sagemaker.
Experience in AWS Step Function and/or AWS Lambda is even better.
Proficiency in Scala and Java programming languages.
Enjoy iterating quickly with research prototypes and learning new technologies.


Insights on salary & in-demand skills


Reviews from people working in the industry

",Jakarta,"Information & Communication Technology","Database Development & Administration",2024-01-22,Contract/Temp,"Rp 13,333,333 – Rp 20,000,000 per month","PT Nomura Research Institute Indonesia",0,0,0,0,0
163,72865183,"Data Analytics Officer","Melakukan big data analytics atas data yang telah disediakan
Melakukan analisa data (predictive and prescriptive) untuk menghasilkan rekomendasi dalam pengembangan produk baru atau produk yang sudah ada dan atau keperluan risk improvement
Melakukan analisa Claim Experience Ratio (CER)
Pendidikan 
S1 Matematika
; fresh-graduate dipersilahkan untuk melamar
Lebih diutamakan mengerti bahasa pemrograman Phyton
Berintegritas dan memiliki daya analisis yang baik
Mampu bekerja sama dan memiliki komunikasi yang baik dalam bahasa Inggris
What's your expected monthly basic salary?
Which of the following programming languages are you experienced in?
Which of the following languages are you fluent in?


Research salaries and job trends


Access free tools, templates and articles that help you stand out


Discover pathways to a huge range of careers

",Tangerang,"Science & Technology","Mathematics, Statistics & Information Sciences",2024-01-29,"Full time",,"PT Lippo General Insurance Tbk",30,28,9,1,1
164,73386336,"AI/Machine Learning Developer","Pendidikan Min. D3/S1
Pengalaman setidaknya 1-2 tahun sebagai AI Developer atau sejenisnya.
Memahami penggunaan bahasa pemrograman dalam AI (Phyton, R, Java, C++, MATLAB).
Memiliki penetahuan dalam penggunaan Big Data (Hadoop, Spark, Kafka, atau Hive).
Familiar dengan penggunaan Framework yang berkaitan dengan AI (TensorFlow, PyTorch, Scikil-learn, OpenCV, NLTK, atau Spacy).
Berpengalaman dalam penggunaan Machine Learning, Deep Learning, Speech Recognition, atau Computer Vision.
Memiliki kemampuan komunikasi yang baik.
Dapat bekerja secara Tim ataupun Individu.
Penempatan Yogyakarta (Remote).
What's your expected monthly basic salary?
How many years' experience do you have as a Machine Learning Developer?
Which of the following programming languages are you experienced in?
Which of the following data analytics tools are you experienced with?
Have you worked in a role which requires experience with machine learning techniques?
Which of the following Relational Database Management Systems (RDBMS) are you experienced with?
How much notice are you required to give your current employer?


Research salaries and job trends


Access free tools, templates and articles that help you stand out


Discover pathways to a huge range of careers

",Yogyakarta,"Science & Technology","Mathematics, Statistics & Information Sciences",2024-01-30,"Full time",,"PT Karya Solusi Prima Sejahtera",11,7,3,0,0
166,73429004,"Business Analyst Jakarta","

Insights on salary & in-demand skills


Reviews from people working in the industry

",Jakarta,Accounting,"Analysis & Reporting",2024-01-31,"Full time","Rp 5,000,000 – Rp 7,000,000 per month","PT Galva Galindra Multi Cipta",6,5,1,0,0
167,73302796,"Data Engineer","Candidate must possess at least bachelor degree (Computer Science/IT related discipline)
Min 2 years working experience as Data Engineer
Experience with Java, Scala, and Python programming languages
Familiar with SQL Server and TSQL (Query, Trigger, Store Procedure)
Experience with technology of 
SSIS (ETL SSIS) and SSAS in SQL Serve
r
Machine learning experience with Spark or similar
Certified Data Engineers or Solution Architect in 1 or more Cloud Technologies (AWS, GCP, Azure)
Ability to manage numerous requests concurrently and be able to prioritize and deliver
Good communication skill & dynamic team player
What's your expected monthly basic salary?
How many years' experience do you have as a Data Engineer?
Which of the following programming languages are you experienced in?
Which of the following Relational Database Management Systems (RDBMS) are you experienced with?
How many years' experience do you have using SQL queries?


Insights on salary & in-demand skills


Reviews from people working in the industry

",Jakarta,"Science & Technology","Mathematics, Statistics & Information Sciences",2024-01-25,"Full time",,"PT XSIS MITRA UTAMA - Recruitment Center",11,16,11,4,6
168,73187782,"Data Engineer","Convert Raw data into usable data
Manage data repositories, Architecture Data Platform, Data Stores, ETL Process, Integration Platforms
Develop and maintain data architectures and make data available for business operations and analysis (provide high availability, flexibility, accessibility, and security)
Develop tools, workflows, processes and dashboard that help you acquire data from multiple sources
Background in Engineering, Computer Science, Mathematics, Statistics
Min 2 years experiences as Data Engineer & Analyst
Must have good knowledge of programming, sound knowledge of systems and technology architectures, and in-depth understanding of relational databases and non-relational data stores
All Data Cascade Realtime
Percent of self-supported queries
Mean Time To Detect and Respond (MTTD-R)
Service uptime
Quantitative data quality
All Data Cascade Realtime
Percent of self-supported queries
Mean Time To Detect and Respond (MTTD-R)
Service uptime
Quantitative data quality
What's your expected monthly basic salary?
How many years' experience do you have as a Data Engineer?
Which of the following programming languages are you experienced in?
Which of the following data analytics tools are you experienced with?
Which of the following Relational Database Management Systems (RDBMS) are you experienced with?
How many years' experience do you have using SQL queries?","South Jakarta","Science & Technology","Mathematics, Statistics & Information Sciences",2024-01-20,"Full time",,"PT Foom Lab Global",0,0,0,0,0
169,73360017,"Data Engineer","Translating data and business requirements into data engineering processes that match business requirement.
Provide consultation to Data Analyst / Business Analysts related to data engineering (ingestion, export, landing, batch, etc).
Together with the data modeler teams to design, create, manage the Data Warehouse and Data Mart.
Bachelor Degree in a computer science or related field of study
Have experience at least 3 years as Data Engineer, ETL Developer or relevant positions
Have deep knowledge with data profiling, data mapping, extraction, transformation and loading data from variance of data sources
Have experiences in Data Architecture, Data Security, and Big Data
Having skill in Microsoft SSIS, SQL Server, and PostgreSQL (Database)
Familiar with T-SQL and PL/SQL Stored Procedure is preferred
Familiar with Azure ETL products (Azure Data Factory, Azure Synapse, Azure Datalake, Azure Devops) is preferred
We offer very 
attractive salary
 and 
outstanding benefits
Most of our clients are multinational company which you will be exposed to a large IT environment and 
valuable experience 
in 
international scale projects
You will 
always learn new things
 as our projects always adopt latest technology and best practice available in the market
Last but not least, we offer a supportive and encouraging environment that puts the emphasis on teamwork. Here, your 
soft skil
l (professional relationships, character, attitude)
 will grow
 as fast as your technical skill
What's your expected monthly basic salary?
How many years' experience do you have as a Data Engineer?
Do you have a Bachelor Degree?


Insights on salary & in-demand skills


Reviews from people working in the industry

","South Jakarta","Science & Technology","Mathematics, Statistics & Information Sciences",2024-01-29,"Full time",,"PT Kamoro Maxima Integra",3,1,0,1,0
170,73369730,"Data Analyst","Data Processing using Microsoft Excel
Manage Contact Care Center (CCC - Application)
Create internal service ticket (Installation/PM)
Update customer contract SLA at CCC
Validate & update customer SLA data
Manage & monitor Rental Asset Management Bank and Non-Bank
Input and Monitoring of customer SLA report dashboard
Create Weekly and Monthly Reports to Dashboard Management
Good Knowledge of SQL Server & Power BI
Minimum S1 majoring in Informatics Engineering or related majors
Minimum 1 year experience as data analyst
Familiar with using Microsoft Excel & Power BI Dashboard
Have the ability to perform data processing
Good Communication Skills
How many years' experience do you have as a data analyst?


Insights on salary & in-demand skills


Reviews from people working in the industry

","South Jakarta","Information & Communication Technology","Database Development & Administration",2024-01-29,"Full time",,"PT Intikom Berlian Mustika",12,10,10,0,0
171,73582593,"Research Analyst","Build and design research based on current issues in national 
Formulate quick responses and strategies based on quantitative data
Analyse and interpret various data into meaningful information
Analysis of data and information structure
Guide Data Processing to identify and construct effective analysis approaches
Check the accuracy of data tabulations, raw data produced by data processing
Analyze and interpret data to identify patterns
Processing survey results
Write a research report
Candidates must have at least a Bachelor's, Master's/Postgraduate degree in Political Science, Statistics or equivalent
⁠have experience working in the field of political consulting
⁠have experience in political research or processing political survey data
Strong attention to detail
Demonstrated good communication skills, strong leadership, initiative, interpersonal skills, ethics, teamwork, control function, and well-organized multitasking
Good in Ms. Office
Available to work as soon as possible
What's your expected monthly basic salary?
How many years' experience do you have as a Research Analyst?
How much notice are you required to give your current employer?
Are you available to work outside your usual hours when required? (e.g. weekends, evenings, public holidays)


Insights on salary & in-demand skills


Reviews from people working in the industry

","South Jakarta","Consulting & Strategy",Analysts,2024-02-07,"Full time",,"PT Media Wave Interaktif",0,0,0,0,0
172,73275582,"Digital Channel and Data Engineer Specialist","Minimum bachelor degree of any major
Minimum 3 years working experience in related field
Experienced in using SQL / PostgreSQL or similar tools
Experienced in SSIS / Airflow / Cloudera / Alteryx / Informatica / Snowflake or similar tools
Proven experience in consolidating multiple data sources into data warehouse / data marts
Proven experience in developing data pipeline and maintaining ETL tools
Good understanding of data engineering and data modeling concepts
Perform end-to-end data warehouse development
Design customer data structure to allow the program to be used for multiple entities under the same platform
Create functional design documents to ensure developers works and builds in efficient way
Developing and maintaining databases, data systems - reorganizing data in readable format
Develop and applies analytical algorithms and methods where possible with a view of driving and enhancing data systems and streamlining business processes
What's your expected monthly basic salary?","Central Jakarta","Information & Communication Technology","Database Development & Administration",2024-01-24,"Full time",,"FKS Group",5,1,2,1,0
173,73270030,"AI and Machine Learning Program","Design and develop AI/Machine Learning algorithms and models.
Conduct technology research in AI, ML, Deep Learning (DL) and large language models.
Collaborate with Frontend developers and other developers/designers.
Optimize AI/Machine Learning models for performance and scalability.
Keep up-to-date with AI/Machine Learning research and industry trends.
Preferably experienced Python, AI and Machine Learning at least a year
Preferably proficient in NLP or Image Processing
Minimum S1 graduate
Passion in coding
Eager to learn for new technology
Have good communication skills
Able to work in a team or individually
Able to work under pressure and to the given timeline
Can travel out of town / abroad (if needed)
Work from Office
Bahasa pemrograman apa saja di bawah ini yang bisa kamu gunakan?
Sistem Relational Database Management (RDBMS) apa saja yang bisa kamu gunakan?
Library/framework front end apa saja di bawah ini yang bisa kamu gunakan?
Bahasa apa saja di bawah ini yang fasih kamu gunakan?
Berapa tahun pengalaman kerjamu sebagai programmer?
Berapa tahun pengalaman kerjamu di bidang pengembangan software?
How many years' experience do you have as a Machine Learning Developer?


Research salaries and job trends


Access free tools, templates and articles that help you stand out


Discover pathways to a huge range of careers

","North Jakarta","Information & Communication Technology",Developers/Programmers,2024-01-24,"Full time",,"PT Newfemme Wanita Indonesia",0,0,0,0,0
